### ISSUE TITLE
Unable to control W11-N13 via MQTT or udp-color

### ISSUE THREAD

**Issue by pjx78** [HamzaETTH/SengledTools#33]
Server running on MX Linux, debian version 12.
Successfully connected to wifi using the setup wizard. Near the end of the setup, the mqtt test timed out, but upd test succeeded. 
Manual MQTT command below:

```
$ python3 sengled_tool.py --run-servers

────────────────────────────────────────────────────────────
                      Starting Servers
────────────────────────────────────────────────────────────
You might need to wait up to a minute or so for the bulb to reconnect
[…] Starting MQTT broker...
    [✓] MQTT broker running on port 8883 (TLS)
[…] Starting HTTP server...
    [✓] HTTP server running on 0.0.0.0:57542 (HTTP)
[✓] HTTP server running on port 57542
Servers are running. Bulbs can connect to:
  MQTT: 172.16.99.107:8883
  HTTP: 172.16.99.107:57542
Press Ctrl+C to stop both servers
[✓] Served GET on /jbalancer/new/bimqtt
[✓] Served GET on /jbalancer/new/bimqtt

$ python3 sengled_tool.py --mac d8:5d:e2:9b:0c:09 --off --verbose
[debug] Normalized MAC address: D8:5D:E2:9B:0C:09
[debug] Certificates already exist, skipping generation
[…] Starting MQTT broker...
MQTT control target (for bulb): 172.16.99.107:8883 [embedded]
Connecting from this PC to: 127.0.0.1:8883
[debug] Auto-detected local broker CA certificate
[debug] Setting up TLS without client certificates
[debug] Attempting MQTT connect to 127.0.0.1:8883
[debug] MQTT log [16]: Sending CONNECT (u0, p0, wr0, wq0, wf0, c1, k60) client_id=b'sengled_client_2fd8128e'
[debug] MQTT client loop started, waiting for connection...
[debug] MQTT log [16]: Received CONNACK (0, 0)
[debug] Connection completed with return code: 0
[debug] Topic: wifielement/D8:5D:E2:9B:0C:09/update
[debug] Payload: [{"dn": "D8:5D:E2:9B:0C:09", "type": "switch", "value": "0", "time": 1757699581486}]
[debug] MQTT log [16]: Sending PUBLISH (d0, q1, r0, m1), 'b'wifielement/D8:5D:E2:9B:0C:09/update'', ... (84 bytes)
[debug] MQTT log [16]: Received PUBACK (Mid: 1)
[✓] Command sent successfully
[debug] MQTT log [16]: Sending DISCONNECT
[debug] MQTT client disconnected with return code: 0
```

TCPdump shows communication between the bulb and server:

```
$ sudo tcpdump -enni any host 172.16.99.108
tcpdump: data link type LINUX_SLL2
tcpdump: verbose output suppressed, use -v[v]... for full protocol decode
listening on any, link-type LINUX_SLL2 (Linux cooked v2), snapshot length 262144 bytes
13:25:06.729558 wlan0 In  ifindex 2 b0:f8:93:8e:f2:11 ethertype IPv4 (0x0800), length 64: 172.16.99.108.61960 > 172.16.99.107.57542: Flags [S], seq 117120533, win 8760, options [mss 1460], length 0
13:25:06.729733 wlan0 Out ifindex 2 d8:5d:e2:9b:0c:09 ethertype IPv4 (0x0800), length 64: 172.16.99.107.57542 > 172.16.99.108.61960: Flags [S.], seq 2091957345, ack 117120534, win 64240, options [mss 1460], length 0
13:25:06.747585 wlan0 In  ifindex 2 b0:f8:93:8e:f2:11 ethertype IPv4 (0x0800), length 60: 172.16.99.108.61960 > 172.16.99.107.57542: Flags [.], ack 1, win 8760, length 0
13:25:06.748055 wlan0 In  ifindex 2 b0:f8:93:8e:f2:11 ethertype IPv4 (0x0800), length 170: 172.16.99.108.61960 > 172.16.99.107.57542: Flags [P.], seq 1:111, ack 1, win 8760, length 110
13:25:06.748146 wlan0 Out ifindex 2 d8:5d:e2:9b:0c:09 ethertype IPv4 (0x0800), length 60: 172.16.99.107.57542 > 172.16.99.108.61960: Flags [.], ack 111, win 64130, length 0
13:25:06.750116 wlan0 Out ifindex 2 d8:5d:e2:9b:0c:09 ethertype IPv4 (0x0800), length 204: 172.16.99.107.57542 > 172.16.99.108.61960: Flags [P.], seq 1:145, ack 111, win 64130, length 144
13:25:06.750733 wlan0 Out ifindex 2 d8:5d:e2:9b:0c:09 ethertype IPv4 (0x0800), length 119: 172.16.99.107.57542 > 172.16.99.108.61960: Flags [FP.], seq 145:204, ack 111, win 64130, length 59
13:25:06.756899 wlan0 In  ifindex 2 b0:f8:93:8e:f2:11 ethertype IPv4 (0x0800), length 60: 172.16.99.108.61960 > 172.16.99.107.57542: Flags [.], ack 205, win 8556, length 0
13:25:06.758730 wlan0 In  ifindex 2 b0:f8:93:8e:f2:11 ethertype IPv4 (0x0800), length 60: 172.16.99.108.61960 > 172.16.99.107.57542: Flags [F.], seq 111, ack 205, win 8556, length 0
13:25:06.758827 wlan0 Out ifindex 2 d8:5d:e2:9b:0c:09 ethertype IPv4 (0x0800), length 60: 172.16.99.107.57542 > 172.16.99.108.61960: Flags [.], ack 112, win 64130, length 0
```

Additionally, the udp-color command has no effect, while on/off/brightness work as expected.
`$ python3 sengled_tool.py --ip 172.16.99.108 --udp-color 100 100 100`
